<?xml version="1.0" encoding="UTF-8"?>
<assetInteractiveFeatureRequest action="add" audit="" service="HBO" tkey="" type="ASSET" user="" xmlns:xsi="http://www.w3.org/2001/XMLSchema-instance" xsi:noNamespaceSchemaLocation="AssetInteractiveFeatureRequest.xsd">
  <interactiveFeatures>
    <interactiveFeature>
      <id>id</id>
      <deviceCode>deviceCode</deviceCode>
      <interactiveFeatureType>interactiveFeatureType</interactiveFeatureType>
      <talentName>talentName</talentName>
      <talentTwitterName>talentTwitterName</talentTwitterName>
      <browseMetadataLocations>
        <browseMetadata action="add">
          <id>id</id>
          <type>type</type>
          <url>url</url>
        </browseMetadata>
        <browseMetadata>
        	<id>id</id>
        	<type>type</type>
        	<url>url</url>
        </browseMetadata>
        <browseMetadata>
        	<id>id</id>
        	<type>type</type>
        	<url>url</url>
        </browseMetadata>
      </browseMetadataLocations>
      <alerts>
        <alert action="add">
          <id>id</id>
          <startTime>0</startTime>
          <stopTime>0</stopTime>
          <title>title</title>
          <twitterName>twitterName</twitterName>
          <description>description</description>
          <themeClass>themeClass</themeClass>
          <images>
          	<image>
          		<id>id</id>
          		<imageClass>imageClass</imageClass>
          		<previousImageClass>0</previousImageClass>
          		<type>type</type>
          		<title>title</title>
          		<did>did</did>
          		<fileName>fileName</fileName>
          		<focusId>focusId</focusId>
          	</image></images>
          <videoClips>
          	<videoClip>
          		<id>id</id>
          		<videoClipClass>videoClipClass</videoClipClass>
          		<previousVideoClipClass>0</previousVideoClipClass>
          		<title>title</title>
          		<did>did</did>
          		<fileName>fileName</fileName>
          		<focusId>focusId</focusId>
          	</videoClip></videoClips>
        </alert>
        <alert>
        	<id>id</id>
        	<startTime>0</startTime>
        	<stopTime>0</stopTime>
        	<title>title</title>
        	<twitterName>twitterName</twitterName>
        	<description>description</description>
        	<themeClass>themeClass</themeClass>
        	<images></images>
        	<videoClips></videoClips>
        </alert>
        <alert>
        	<id>id</id>
        	<startTime>0</startTime>
        	<stopTime>0</stopTime>
        	<title>title</title>
        	<twitterName>twitterName</twitterName>
        	<description>description</description>
        	<themeClass>themeClass</themeClass>
        	<images></images>
        	<videoClips></videoClips>
        </alert>
      </alerts>
    </interactiveFeature>
    <interactiveFeature>
    	<id>id</id>
    	<interactiveFeatureType>
    		interactiveFeatureType
    	</interactiveFeatureType>
    	<talentName>talentName</talentName>
    	<talentTwitterName>talentTwitterName</talentTwitterName>
    	<browseMetadataLocations>
    		<browseMetadata>
    			<id>id</id>
    			<type>type</type>
    			<url>url</url>
    		</browseMetadata>
    		<browseMetadata>
    			<id>id</id>
    			<type>type</type>
    			<url>url</url>
    		</browseMetadata></browseMetadataLocations>
    	<deviceCode>deviceCode</deviceCode>
    	<alerts>
    		<alert>
    			<id>id</id>
    			<startTime>0</startTime>
    			<stopTime>0</stopTime>
    			<title>title</title>
    			<twitterName>twitterName</twitterName>
    			<description>description</description>
    			<themeClass>themeClass</themeClass>
    			<images></images>
    			<videoClips></videoClips>
    		</alert>
    		<alert>
    			<id>id</id>
    			<startTime>0</startTime>
    			<stopTime>0</stopTime>
    			<title>title</title>
    			<twitterName>twitterName</twitterName>
    			<description>description</description>
    			<themeClass>themeClass</themeClass>
    			<images></images>
    			<videoClips></videoClips>
    		</alert></alerts>
    </interactiveFeature>
    <interactiveFeature>
    	<id>id</id>
    	<interactiveFeatureType>
    		interactiveFeatureType
    	</interactiveFeatureType>
    	<talentName>talentName</talentName>
    	<talentTwitterName>talentTwitterName</talentTwitterName>
    	<browseMetadataLocations>
    		<browseMetadata>
    			<id>id</id>
    			<type>type</type>
    			<url>url</url>
    		</browseMetadata>
    		<browseMetadata>
    			<id>id</id>
    			<type>type</type>
    			<url>url</url>
    		</browseMetadata></browseMetadataLocations>
    	<deviceCode>deviceCode</deviceCode>
    	<alerts>
    		<alert>
    			<id>id</id>
    			<startTime>0</startTime>
    			<stopTime>0</stopTime>
    			<title>title</title>
    			<twitterName>twitterName</twitterName>
    			<description>description</description>
    			<themeClass>themeClass</themeClass>
    			<images></images>
    			<videoClips></videoClips>
    		</alert>
    		<alert>
    			<id>id</id>
    			<startTime>0</startTime>
    			<stopTime>0</stopTime>
    			<title>title</title>
    			<twitterName>twitterName</twitterName>
    			<description>description</description>
    			<themeClass>themeClass</themeClass>
    			<images></images>
    			<videoClips></videoClips>
    		</alert></alerts>
    </interactiveFeature>
  </interactiveFeatures>
</assetInteractiveFeatureRequest>
